[
  { "termName": "小寒", "dateRule": { "month": 1, "cConstant": 5.4055 }, "farmingTip": "防寒防冻，检查大棚保温", "keyFarmingPeriod": "越冬作物防寒防冻", "applicableCrops": ["冬小麦", "油菜", "大蒜"] },
  { "termName": "大寒", "dateRule": { "month": 1, "cConstant": 20.12 }, "farmingTip": "越冬作物防冻害，积肥备耕", "keyFarmingPeriod": "积肥备耕，设施保温", "applicableCrops": ["冬小麦", "油菜", "蔬菜"] },
  { "termName": "立春", "dateRule": { "month": 2, "cConstant": 3.87 }, "farmingTip": "春耕备耕，检修农机与种子", "keyFarmingPeriod": "春耕备耕，检修农机", "applicableCrops": ["冬小麦", "马铃薯", "蔬菜"] },
  { "termName": "雨水", "dateRule": { "month": 2, "cConstant": 18.73 }, "farmingTip": "返青水与追肥关键期，关注降雨", "keyFarmingPeriod": "返青期追肥浇水", "applicableCrops": ["冬小麦", "油菜", "大蒜"] },
  { "termName": "惊蛰", "dateRule": { "month": 3, "cConstant": 5.63 }, "farmingTip": "病虫害始发，准备第一次防治", "keyFarmingPeriod": "病虫害始发防治", "applicableCrops": ["冬小麦", "果树", "蔬菜"] },
  { "termName": "春分", "dateRule": { "month": 3, "cConstant": 20.646 }, "farmingTip": "春播适宜期，注意倒春寒", "keyFarmingPeriod": "春播春种适宜期", "applicableCrops": ["春小麦", "玉米", "水稻", "棉花"] },
  { "termName": "清明", "dateRule": { "month": 4, "cConstant": 4.81 }, "farmingTip": "播种移栽，清沟排水防涝", "keyFarmingPeriod": "播种移栽，清沟排水", "applicableCrops": ["水稻", "棉花", "蔬菜", "果树"] },
  { "termName": "谷雨", "dateRule": { "month": 4, "cConstant": 20.1 }, "farmingTip": "雨生百谷，肥水管理并防病害", "keyFarmingPeriod": "肥水管理，防病害", "applicableCrops": ["水稻", "棉花", "蔬菜", "茶叶"] },
  { "termName": "立夏", "dateRule": { "month": 5, "cConstant": 5.52 }, "farmingTip": "夏管开始，中耕除草", "keyFarmingPeriod": "夏管开始，中耕除草", "applicableCrops": ["冬小麦", "油菜", "棉花"] },
  { "termName": "小满", "dateRule": { "month": 5, "cConstant": 21.04 }, "farmingTip": "麦类是灌浆关键期，防干热风", "keyFarmingPeriod": "灌浆关键期，防干热风", "applicableCrops": ["冬小麦", "油菜"] },
  { "termName": "芒种", "dateRule": { "month": 6, "cConstant": 5.678 }, "farmingTip": "抢收抢种，农事最忙", "keyFarmingPeriod": "抢收抢种，农事最忙", "applicableCrops": ["冬小麦", "夏玉米", "水稻", "大豆"] },
  { "termName": "夏至", "dateRule": { "month": 6, "cConstant": 21.37 }, "farmingTip": "高温高湿，防治病虫害", "keyFarmingPeriod": "高温高湿，防治病虫害", "applicableCrops": ["玉米", "水稻", "棉花", "蔬菜"] },
  { "termName": "小暑", "dateRule": { "month": 7, "cConstant": 7.108 }, "farmingTip": "防涝抗旱并重，适时灌溉", "keyFarmingPeriod": "防涝抗旱，适时灌溉", "applicableCrops": ["玉米", "水稻", "棉花", "果树"] },
  { "termName": "大暑", "dateRule": { "month": 7, "cConstant": 22.83 }, "farmingTip": "高温期避午间作业，防药害", "keyFarmingPeriod": "高温期避午间作业", "applicableCrops": ["水稻", "棉花", "玉米", "蔬菜"] },
  { "termName": "立秋", "dateRule": { "month": 8, "cConstant": 7.5 }, "farmingTip": "秋季田管，追肥促壮", "keyFarmingPeriod": "秋季田管，追肥促壮", "applicableCrops": ["玉米", "大豆", "棉花", "蔬菜"] },
  { "termName": "处暑", "dateRule": { "month": 8, "cConstant": 23.13 }, "farmingTip": "防早霜，抓好秋收准备", "keyFarmingPeriod": "防早霜，秋收准备", "applicableCrops": ["玉米", "水稻", "大豆", "果树"] },
  { "termName": "白露", "dateRule": { "month": 9, "cConstant": 7.646 }, "farmingTip": "昼夜温差大，注意作物管护", "keyFarmingPeriod": "温差增大，注意管护", "applicableCrops": ["水稻", "玉米", "棉花", "果树"] },
  { "termName": "秋分", "dateRule": { "month": 9, "cConstant": 23.042 }, "farmingTip": "秋收秋种，抢时播种", "keyFarmingPeriod": "秋收秋种，抢时播种", "applicableCrops": ["冬小麦", "油菜", "蔬菜"] },
  { "termName": "寒露", "dateRule": { "month": 10, "cConstant": 8.318 }, "farmingTip": "秋播作物保墒，防寒露风", "keyFarmingPeriod": "秋播保墒，防寒露风", "applicableCrops": ["冬小麦", "油菜", "蔬菜"] },
  { "termName": "霜降", "dateRule": { "month": 10, "cConstant": 23.438 }, "farmingTip": "防初霜冻，及时采收", "keyFarmingPeriod": "防初霜冻，及时采收", "applicableCrops": ["棉花", "果树", "蔬菜", "红薯"] },
  { "termName": "立冬", "dateRule": { "month": 11, "cConstant": 7.438 }, "farmingTip": "冬前管理，浇灌越冬水", "keyFarmingPeriod": "冬前管理，浇越冬水", "applicableCrops": ["冬小麦", "油菜", "大蒜"] },
  { "termName": "小雪", "dateRule": { "month": 11, "cConstant": 22.36 }, "farmingTip": "大棚保温，畜禽防寒", "keyFarmingPeriod": "大棚保温，畜禽防寒", "applicableCrops": ["蔬菜", "果树"] },
  { "termName": "大雪", "dateRule": { "month": 12, "cConstant": 7.18 }, "farmingTip": "积雪保温，清雪护棚", "keyFarmingPeriod": "积雪保温，清雪护棚", "applicableCrops": ["蔬菜", "果树", "冬小麦"] },
  { "termName": "冬至", "dateRule": { "month": 12, "cConstant": 21.94 }, "farmingTip": "数九寒天，越冬作物防冻", "keyFarmingPeriod": "数九寒天，越冬防冻", "applicableCrops": ["冬小麦", "油菜", "大蒜", "果树"] }
]